{
  "contract_version": "ivk-blueprint-1.0",
  "raw_input": {
    "name": "AI Data Center Power / Power Semiconductor",
    "seed": [
      "VRT",
      "ETN",
      "VST",
      "ON",
      "WOLF"
    ],
    "frame": "Sponsor→Value Chain→Bottleneck",
    "thesis": "AI 데이터센터 전력 수요 증가가 UPS·배전·전력반도체·전력관리 설비의 수요와 병목을 확대할 수 있다.",
    "questions": [
      "핵심 수요 드라이버는 무엇인가?",
      "전력 공급망의 병목은 어디에서 발생할 가능성이 높은가?",
      "병목 완화 시 최대 수혜 후보는 누구인가?",
      "어떤 인접 product/process/technology/company로 Link Expansion해야 하는가?"
    ]
  },
  "normalized": {
    "identity": {
      "name": "AI Data Center Power / Power Semiconductor",
      "slug": "ai-data-center-power-power-semiconductor"
    },
    "validated_seeds": [
      {
        "input": "VRT",
        "canonical_id": "VRT",
        "kind": "ticker_or_company_id",
        "role": "starting_point"
      },
      {
        "input": "ETN",
        "canonical_id": "ETN",
        "kind": "ticker_or_company_id",
        "role": "starting_point"
      },
      {
        "input": "VST",
        "canonical_id": "VST",
        "kind": "ticker_or_company_id",
        "role": "starting_point"
      },
      {
        "input": "ON",
        "canonical_id": "ON",
        "kind": "ticker_or_company_id",
        "role": "starting_point"
      },
      {
        "input": "WOLF",
        "canonical_id": "WOLF",
        "kind": "ticker_or_company_id",
        "role": "starting_point"
      }
    ],
    "primary_frame": "Sponsor→Value Chain→Bottleneck",
    "secondary_frame_candidates": [
      "Value Chain",
      "Bottleneck"
    ],
    "thesis": "AI 데이터센터 전력 수요 증가가 UPS·배전·전력반도체·전력관리 설비의 수요와 병목을 확대할 수 있다.",
    "questions": [
      "핵심 수요 드라이버는 무엇인가?",
      "전력 공급망의 병목은 어디에서 발생할 가능성이 높은가?",
      "병목 완화 시 최대 수혜 후보는 누구인가?",
      "어떤 인접 product/process/technology/company로 Link Expansion해야 하는가?"
    ],
    "known_links": [],
    "limitations": [],
    "references": []
  },
  "unresolved_seeds": [
    {
      "seed": "VRT",
      "reason": "no matching Company in live canonical read",
      "disposition": "retain_as_starting_point"
    },
    {
      "seed": "ETN",
      "reason": "no matching Company in live canonical read",
      "disposition": "retain_as_starting_point"
    },
    {
      "seed": "VST",
      "reason": "no matching Company in live canonical read",
      "disposition": "retain_as_starting_point"
    },
    {
      "seed": "ON",
      "reason": "no matching Company in live canonical read",
      "disposition": "retain_as_starting_point"
    },
    {
      "seed": "WOLF",
      "reason": "no matching Company in live canonical read",
      "disposition": "retain_as_starting_point"
    }
  ],
  "excluded_seeds": [],
  "existing_graph": {
    "read_path": "neo4j-official.read_cypher",
    "observed_at": "2026-08-16T00:00:00Z",
    "findings": [
      {
        "seed": "VRT",
        "company": null,
        "value_chain": [],
        "assertions": [],
        "epistemic_status": "graph_observation",
        "review_status": "pending"
      },
      {
        "seed": "ETN",
        "company": null,
        "value_chain": [],
        "assertions": [],
        "epistemic_status": "graph_observation",
        "review_status": "pending"
      },
      {
        "seed": "VST",
        "company": null,
        "value_chain": [],
        "assertions": [],
        "epistemic_status": "graph_observation",
        "review_status": "pending"
      },
      {
        "seed": "ON",
        "company": null,
        "value_chain": [],
        "assertions": [],
        "epistemic_status": "graph_observation",
        "review_status": "pending"
      },
      {
        "seed": "WOLF",
        "company": null,
        "value_chain": [],
        "assertions": [],
        "epistemic_status": "graph_observation",
        "review_status": "pending"
      }
    ]
  },
  "initial_value_chain": {
    "nodes": [],
    "links": [],
    "status": "hypothesis",
    "review_status": "pending"
  },
  "candidate_slots": {
    "drivers": [],
    "bottlenecks": [],
    "beneficiaries": []
  },
  "link_expansion_frontier": [],
  "source_requirements": [
    {
      "question": "핵심 수요 드라이버는 무엇인가?",
      "status": "required",
      "evidence": []
    },
    {
      "question": "전력 공급망의 병목은 어디에서 발생할 가능성이 높은가?",
      "status": "required",
      "evidence": []
    },
    {
      "question": "병목 완화 시 최대 수혜 후보는 누구인가?",
      "status": "required",
      "evidence": []
    },
    {
      "question": "어떤 인접 product/process/technology/company로 Link Expansion해야 하는가?",
      "status": "required",
      "evidence": []
    }
  ],
  "epistemic_policy": {
    "allowed_status": [
      "fact",
      "graph_observation",
      "hypothesis",
      "inference"
    ],
    "allowed_review_status": [
      "accepted",
      "deferred",
      "pending",
      "rejected"
    ],
    "auto_confirm": false
  },
  "review_status": "pending"
}
