{
  "contract_version": "ivk-blueprint-1.0",
  "raw_input": {
    "contract_version": "ivk-intake-1.0",
    "operation": "new",
    "target_vc": null,
    "name": "Korea 후공정 Ecosystem",
    "seed": [
      "KR:131970|두산테스나",
      "KR:183300|코미코",
      "KR:059090|미코",
      "KR:330860|네패스아크",
      "KR:131290|티에스이"
    ],
    "frame": "matrix",
    "thesis": "후공정_idx 구성 기업은 공통 산업·수요 동인에 노출될 가능성이 있으며, 기업별 제품·기능·실적 차이를 비교해 실제 Value Chain 연결, 병목 및 수혜 강도를 검증한다.",
    "questions": [
      "각 seed 기업의 핵심 제품, 기능 및 Value Chain 역할은 무엇인가?",
      "기업들이 공유하는 수요동인과 End Market은 무엇인가?",
      "핵심 공정·제품·기술 병목은 어디에 있는가?",
      "병목의 직접 및 간접 수혜기업은 누구인가?",
      "최근 5분기 실적, 사업부, 재고, 마진 및 증설에서 가설이 확인되는가?",
      "추가 조사하거나 제외해야 할 인접 기업과 연결은 무엇인가?"
    ],
    "scope": [
      "value_chain",
      "products",
      "processes",
      "technologies",
      "end_markets",
      "financials",
      "segment_results",
      "inventory",
      "capex",
      "earnings_call",
      "counter_evidence",
      "link_expansion"
    ],
    "known_links": [],
    "limitations": [
      "kr_idx의 후공정_idx 편입은 조사 출발점이며 기업 간 공급·경쟁 관계를 입증하지 않는다.",
      "Seed는 최종 Value Chain 경계가 아니며 evidence에 따라 추가·제외할 수 있다.",
      "모든 관계는 공시, 어닝콜 또는 신뢰할 수 있는 원문 근거로 검증해야 한다.",
      "근거와 review 없이 후보를 confirmed로 자동 승격하지 않는다."
    ],
    "references": [
      "gs://signals/kr_idx/후공정_idx"
    ],
    "options": {
      "periods": 5,
      "auto_expand": true,
      "write_policy": "approval_required"
    }
  },
  "normalized": {
    "operation": "new",
    "target_vc": null,
    "identity": {
      "name": "Korea 후공정 Ecosystem",
      "slug": "korea-후공정-ecosystem"
    },
    "validated_seeds": [
      {
        "input": "KR:131970|두산테스나",
        "canonical_id": "KR:131970",
        "market": "kr",
        "exchange": null,
        "ticker": "131970",
        "company_name": "두산테스나",
        "provider": "dart",
        "provider_ids": {
          "dart": "131970"
        },
        "kind": "ticker_or_company_id",
        "role": "starting_point"
      },
      {
        "input": "KR:183300|코미코",
        "canonical_id": "KR:183300",
        "market": "kr",
        "exchange": null,
        "ticker": "183300",
        "company_name": "코미코",
        "provider": "dart",
        "provider_ids": {
          "dart": "183300"
        },
        "kind": "ticker_or_company_id",
        "role": "starting_point"
      },
      {
        "input": "KR:059090|미코",
        "canonical_id": "KR:059090",
        "market": "kr",
        "exchange": null,
        "ticker": "059090",
        "company_name": "미코",
        "provider": "dart",
        "provider_ids": {
          "dart": "059090"
        },
        "kind": "ticker_or_company_id",
        "role": "starting_point"
      },
      {
        "input": "KR:330860|네패스아크",
        "canonical_id": "KR:330860",
        "market": "kr",
        "exchange": null,
        "ticker": "330860",
        "company_name": "네패스아크",
        "provider": "dart",
        "provider_ids": {
          "dart": "330860"
        },
        "kind": "ticker_or_company_id",
        "role": "starting_point"
      },
      {
        "input": "KR:131290|티에스이",
        "canonical_id": "KR:131290",
        "market": "kr",
        "exchange": null,
        "ticker": "131290",
        "company_name": "티에스이",
        "provider": "dart",
        "provider_ids": {
          "dart": "131290"
        },
        "kind": "ticker_or_company_id",
        "role": "starting_point"
      }
    ],
    "primary_frame": "Matrix",
    "frame_ref": {
      "id": "matrix",
      "version": "1.0.0",
      "nickname": "matrix",
      "input": "matrix"
    },
    "secondary_frame_candidates": [],
    "thesis": "후공정_idx 구성 기업은 공통 산업·수요 동인에 노출될 가능성이 있으며, 기업별 제품·기능·실적 차이를 비교해 실제 Value Chain 연결, 병목 및 수혜 강도를 검증한다.",
    "questions": [
      "각 seed 기업의 핵심 제품, 기능 및 Value Chain 역할은 무엇인가?",
      "기업들이 공유하는 수요동인과 End Market은 무엇인가?",
      "핵심 공정·제품·기술 병목은 어디에 있는가?",
      "병목의 직접 및 간접 수혜기업은 누구인가?",
      "최근 5분기 실적, 사업부, 재고, 마진 및 증설에서 가설이 확인되는가?",
      "추가 조사하거나 제외해야 할 인접 기업과 연결은 무엇인가?"
    ],
    "scope": [
      "value_chain",
      "products",
      "processes",
      "technologies",
      "end_markets",
      "financials",
      "segment_results",
      "inventory",
      "capex",
      "earnings_call",
      "counter_evidence",
      "link_expansion"
    ],
    "known_links": [],
    "limitations": [
      "kr_idx의 후공정_idx 편입은 조사 출발점이며 기업 간 공급·경쟁 관계를 입증하지 않는다.",
      "Seed는 최종 Value Chain 경계가 아니며 evidence에 따라 추가·제외할 수 있다.",
      "모든 관계는 공시, 어닝콜 또는 신뢰할 수 있는 원문 근거로 검증해야 한다.",
      "근거와 review 없이 후보를 confirmed로 자동 승격하지 않는다."
    ],
    "references": [
      "gs://signals/kr_idx/후공정_idx"
    ],
    "options": {
      "periods": 5,
      "auto_expand": true,
      "write_policy": "approval_required"
    }
  },
  "unresolved_seeds": [
    {
      "seed": "KR:131970",
      "reason": "no matching Company in live canonical read",
      "disposition": "retain_as_starting_point"
    },
    {
      "seed": "KR:183300",
      "reason": "no matching Company in live canonical read",
      "disposition": "retain_as_starting_point"
    },
    {
      "seed": "KR:059090",
      "reason": "no matching Company in live canonical read",
      "disposition": "retain_as_starting_point"
    },
    {
      "seed": "KR:330860",
      "reason": "no matching Company in live canonical read",
      "disposition": "retain_as_starting_point"
    }
  ],
  "excluded_seeds": [],
  "existing_graph": {
    "read_path": "neo4j-official.read_cypher",
    "observed_at": "2026-08-24T11:22:17.019233+00:00",
    "findings": [
      {
        "seed": "KR:131970",
        "company": null,
        "value_chain": [],
        "assertions": [],
        "epistemic_status": "graph_observation",
        "review_status": "pending"
      },
      {
        "seed": "KR:183300",
        "company": null,
        "value_chain": [],
        "assertions": [],
        "epistemic_status": "graph_observation",
        "review_status": "pending"
      },
      {
        "seed": "KR:059090",
        "company": null,
        "value_chain": [],
        "assertions": [],
        "epistemic_status": "graph_observation",
        "review_status": "pending"
      },
      {
        "seed": "KR:330860",
        "company": null,
        "value_chain": [],
        "assertions": [],
        "epistemic_status": "graph_observation",
        "review_status": "pending"
      },
      {
        "seed": "KR:131290",
        "company": {
          "id": "company:tse",
          "ticker": "131290",
          "name": "티에스이"
        },
        "value_chain": [
          {
            "entity_type": "EndMarket",
            "id": "market:dram",
            "name": "DRAM / HBM",
            "relationship": "EXPOSED_TO",
            "status": "supplemental"
          },
          {
            "entity_type": "Process",
            "id": "stage:wafer_test",
            "name": "Wafer Test Cell",
            "relationship": "OPERATES_IN",
            "status": "reported"
          },
          {
            "entity_type": "Product",
            "id": "product:test_socket",
            "name": "Test Socket",
            "relationship": "PRODUCES",
            "status": "reported"
          },
          {
            "entity_type": "Product",
            "id": "product:interface_board",
            "name": "Interface Board",
            "relationship": "PRODUCES",
            "status": "reported"
          },
          {
            "entity_type": "Product",
            "id": "product:probe_card",
            "name": "Probe Card",
            "relationship": "PRODUCES",
            "status": "reported"
          }
        ],
        "assertions": [],
        "epistemic_status": "graph_observation",
        "review_status": "pending"
      }
    ]
  },
  "initial_value_chain": {
    "nodes": [],
    "links": [],
    "status": "hypothesis",
    "review_status": "pending"
  },
  "candidate_slots": {
    "drivers": [],
    "bottlenecks": [],
    "beneficiaries": []
  },
  "link_expansion_frontier": [],
  "source_requirements": [
    {
      "question": "각 seed 기업의 핵심 제품, 기능 및 Value Chain 역할은 무엇인가?",
      "status": "required",
      "evidence": []
    },
    {
      "question": "기업들이 공유하는 수요동인과 End Market은 무엇인가?",
      "status": "required",
      "evidence": []
    },
    {
      "question": "핵심 공정·제품·기술 병목은 어디에 있는가?",
      "status": "required",
      "evidence": []
    },
    {
      "question": "병목의 직접 및 간접 수혜기업은 누구인가?",
      "status": "required",
      "evidence": []
    },
    {
      "question": "최근 5분기 실적, 사업부, 재고, 마진 및 증설에서 가설이 확인되는가?",
      "status": "required",
      "evidence": []
    },
    {
      "question": "추가 조사하거나 제외해야 할 인접 기업과 연결은 무엇인가?",
      "status": "required",
      "evidence": []
    }
  ],
  "epistemic_policy": {
    "allowed_status": [
      "fact",
      "graph_observation",
      "hypothesis",
      "inference"
    ],
    "allowed_review_status": [
      "accepted",
      "deferred",
      "pending",
      "rejected"
    ],
    "auto_confirm": false
  },
  "review_status": "pending"
}
