{
  "contract_version": "ivk-blueprint-1.0",
  "raw_input": {
    "contract_version": "ivk-intake-1.0",
    "operation": "new",
    "target_vc": null,
    "name": "US optic Ecosystem",
    "seed": [
      "LITE",
      "CRDO",
      "COHR",
      "AAOI"
    ],
    "frame": "matrix",
    "thesis": "optic_idx 구성 기업은 공통 산업·수요 동인에 노출될 가능성이 있으며, 기업별 제품·기능·실적 차이를 비교해 실제 Value Chain 연결, 병목 및 수혜 강도를 검증한다.",
    "questions": [
      "각 seed 기업의 핵심 제품, 기능 및 Value Chain 역할은 무엇인가?",
      "기업들이 공유하는 수요동인과 End Market은 무엇인가?",
      "핵심 공정·제품·기술 병목은 어디에 있는가?",
      "병목의 직접 및 간접 수혜기업은 누구인가?",
      "최근 5분기 실적, 사업부, 재고, 마진 및 증설에서 가설이 확인되는가?",
      "추가 조사하거나 제외해야 할 인접 기업과 연결은 무엇인가?"
    ],
    "scope": [
      "value_chain",
      "products",
      "processes",
      "technologies",
      "end_markets",
      "financials",
      "segment_results",
      "inventory",
      "capex",
      "earnings_call",
      "counter_evidence",
      "link_expansion"
    ],
    "known_links": [],
    "limitations": [
      "us_idx의 optic_idx 편입은 조사 출발점이며 기업 간 공급·경쟁 관계를 입증하지 않는다.",
      "Seed는 최종 Value Chain 경계가 아니며 evidence에 따라 추가·제외할 수 있다.",
      "모든 관계는 공시, 어닝콜 또는 신뢰할 수 있는 원문 근거로 검증해야 한다.",
      "근거와 review 없이 후보를 confirmed로 자동 승격하지 않는다."
    ],
    "references": [
      "gs://signals/us_idx/optic_idx"
    ],
    "options": {
      "periods": 5,
      "auto_expand": true,
      "write_policy": "approval_required"
    }
  },
  "normalized": {
    "operation": "new",
    "target_vc": null,
    "identity": {
      "name": "US optic Ecosystem",
      "slug": "us-optic-ecosystem"
    },
    "validated_seeds": [
      {
        "input": "LITE",
        "canonical_id": "LITE",
        "kind": "ticker_or_company_id",
        "role": "starting_point"
      },
      {
        "input": "CRDO",
        "canonical_id": "CRDO",
        "kind": "ticker_or_company_id",
        "role": "starting_point"
      },
      {
        "input": "COHR",
        "canonical_id": "COHR",
        "kind": "ticker_or_company_id",
        "role": "starting_point"
      },
      {
        "input": "AAOI",
        "canonical_id": "AAOI",
        "kind": "ticker_or_company_id",
        "role": "starting_point"
      }
    ],
    "primary_frame": "Matrix",
    "frame_ref": {
      "id": "matrix",
      "version": "1.0.0",
      "nickname": "matrix",
      "input": "matrix"
    },
    "secondary_frame_candidates": [],
    "thesis": "optic_idx 구성 기업은 공통 산업·수요 동인에 노출될 가능성이 있으며, 기업별 제품·기능·실적 차이를 비교해 실제 Value Chain 연결, 병목 및 수혜 강도를 검증한다.",
    "questions": [
      "각 seed 기업의 핵심 제품, 기능 및 Value Chain 역할은 무엇인가?",
      "기업들이 공유하는 수요동인과 End Market은 무엇인가?",
      "핵심 공정·제품·기술 병목은 어디에 있는가?",
      "병목의 직접 및 간접 수혜기업은 누구인가?",
      "최근 5분기 실적, 사업부, 재고, 마진 및 증설에서 가설이 확인되는가?",
      "추가 조사하거나 제외해야 할 인접 기업과 연결은 무엇인가?"
    ],
    "scope": [
      "value_chain",
      "products",
      "processes",
      "technologies",
      "end_markets",
      "financials",
      "segment_results",
      "inventory",
      "capex",
      "earnings_call",
      "counter_evidence",
      "link_expansion"
    ],
    "known_links": [],
    "limitations": [
      "us_idx의 optic_idx 편입은 조사 출발점이며 기업 간 공급·경쟁 관계를 입증하지 않는다.",
      "Seed는 최종 Value Chain 경계가 아니며 evidence에 따라 추가·제외할 수 있다.",
      "모든 관계는 공시, 어닝콜 또는 신뢰할 수 있는 원문 근거로 검증해야 한다.",
      "근거와 review 없이 후보를 confirmed로 자동 승격하지 않는다."
    ],
    "references": [
      "gs://signals/us_idx/optic_idx"
    ],
    "options": {
      "periods": 5,
      "auto_expand": true,
      "write_policy": "approval_required"
    }
  },
  "unresolved_seeds": [
    {
      "seed": "LITE",
      "reason": "no matching Company in live canonical read",
      "disposition": "retain_as_starting_point"
    },
    {
      "seed": "CRDO",
      "reason": "no matching Company in live canonical read",
      "disposition": "retain_as_starting_point"
    },
    {
      "seed": "COHR",
      "reason": "no matching Company in live canonical read",
      "disposition": "retain_as_starting_point"
    },
    {
      "seed": "AAOI",
      "reason": "no matching Company in live canonical read",
      "disposition": "retain_as_starting_point"
    }
  ],
  "excluded_seeds": [],
  "existing_graph": {
    "read_path": "neo4j-official.read_cypher",
    "observed_at": "2026-08-23T01:51:36.388989+00:00",
    "findings": [
      {
        "assertions": [],
        "company": null,
        "seed": "LITE",
        "value_chain": [],
        "epistemic_status": "graph_observation",
        "review_status": "pending"
      },
      {
        "assertions": [],
        "company": null,
        "seed": "CRDO",
        "value_chain": [],
        "epistemic_status": "graph_observation",
        "review_status": "pending"
      },
      {
        "assertions": [],
        "company": null,
        "seed": "COHR",
        "value_chain": [],
        "epistemic_status": "graph_observation",
        "review_status": "pending"
      },
      {
        "assertions": [],
        "company": null,
        "seed": "AAOI",
        "value_chain": [],
        "epistemic_status": "graph_observation",
        "review_status": "pending"
      }
    ]
  },
  "initial_value_chain": {
    "nodes": [],
    "links": [],
    "status": "hypothesis",
    "review_status": "pending"
  },
  "candidate_slots": {
    "drivers": [],
    "bottlenecks": [],
    "beneficiaries": []
  },
  "link_expansion_frontier": [],
  "source_requirements": [
    {
      "question": "각 seed 기업의 핵심 제품, 기능 및 Value Chain 역할은 무엇인가?",
      "status": "required",
      "evidence": []
    },
    {
      "question": "기업들이 공유하는 수요동인과 End Market은 무엇인가?",
      "status": "required",
      "evidence": []
    },
    {
      "question": "핵심 공정·제품·기술 병목은 어디에 있는가?",
      "status": "required",
      "evidence": []
    },
    {
      "question": "병목의 직접 및 간접 수혜기업은 누구인가?",
      "status": "required",
      "evidence": []
    },
    {
      "question": "최근 5분기 실적, 사업부, 재고, 마진 및 증설에서 가설이 확인되는가?",
      "status": "required",
      "evidence": []
    },
    {
      "question": "추가 조사하거나 제외해야 할 인접 기업과 연결은 무엇인가?",
      "status": "required",
      "evidence": []
    }
  ],
  "epistemic_policy": {
    "allowed_status": [
      "fact",
      "graph_observation",
      "hypothesis",
      "inference"
    ],
    "allowed_review_status": [
      "accepted",
      "deferred",
      "pending",
      "rejected"
    ],
    "auto_confirm": false
  },
  "review_status": "pending"
}
